{
  "apiVersion": "graphengineering.reacher-z.github.io/v1alpha1",
  "kind": "Graph",
  "metadata": { "name": "policy-extension-python-name-null", "version": "1.0.0" },
  "inputSchema": {},
  "outputSchema": {},
  "entrypoints": ["node"],
  "outputs": { "result": { "node": "node" } },
  "nodes": [
    { "id": "node", "kind": "transform", "inputSchema": {}, "outputSchema": {}, "config": {} }
  ],
  "edges": [],
  "policies": { "max_concurrency": null }
}
