{
  "apiVersion": "graphengineering.reacher-z.github.io/v1alpha1",
  "kind": "Graph",
  "metadata": {
    "name": "unicode-keys",
    "version": "1.0.0",
    "description": "Unicode ☃ and astral 😀",
    "labels": {
      "é": "composed",
      "é": "decomposed"
    }
  },
  "inputSchema": { "type": "object" },
  "outputSchema": { "type": "object" },
  "entrypoints": ["unicode"],
  "outputs": {
    "__proto__": { "node": "unicode" },
    "结果": { "node": "unicode" }
  },
  "nodes": [
    {
      "id": "unicode",
      "kind": "transform",
      "inputSchema": { "type": "object" },
      "outputSchema": { "type": "object" },
      "config": {
        "lone-surrogate": "\ud800",
        "astral": "😀",
        "slash/key": "tilde~value"
      }
    }
  ],
  "edges": []
}
