{
  "apiVersion": "graphengineering.reacher-z.github.io/v1alpha1",
  "kind": "Graph",
  "metadata": { "name": "typed-boolean-subschema", "version": "1.0.0" },
  "inputSchema": { "type": "object", "properties": { "input": true }, "required": ["input"] },
  "outputSchema": { "type": "object", "properties": { "result": true }, "required": ["result"] },
  "entrypoints": ["source"],
  "outputs": { "result": { "node": "target", "port": "result" } },
  "nodes": [
    {
      "id": "source",
      "kind": "transform",
      "inputSchema": { "type": "object", "properties": { "input": true }, "required": ["input"] },
      "outputSchema": { "type": "object", "properties": { "payload": true }, "required": ["payload"] },
      "config": {}
    },
    {
      "id": "target",
      "kind": "transform",
      "inputSchema": { "type": "object", "properties": { "payload": true }, "required": ["payload"] },
      "outputSchema": { "type": "object", "properties": { "result": true }, "required": ["result"] },
      "config": {}
    }
  ],
  "edges": [{ "id": "edge", "from": { "node": "source", "port": "payload" }, "to": { "node": "target", "port": "payload" }, "mode": "value" }],
  "policies": { "graphengineering.reacher-z.github.io/typed-ports": { "apiVersion": "graphengineering.reacher-z.github.io/typed-ports/v1alpha1", "mode": "strict-exact" } }
}
